{
  "$schema": "mod.dluma.schema.json",
  "schema": "dluma.mod.v1",
  "api_version": "1.0",
  "id": "thirdperson.camera",
  "name": "Third Person",
  "version": "1.1.3",
  "description": "Adjustable third-person shoulder camera with keyboard controls and mouse orbit.",
  "author": "DLUMA",
  "language": "native",
  "scope": "global",
  "entry": "ThirdPerson.dll",
  "load_priority": 1000,
  "hosts": [
    "player"
  ],
  "access": [
    "game.read",
    "player.read",
    "configuration.read",
    "storage.mod"
  ],
  "configuration": {
    "schema": "config.dluma.json"
  }
}
